{
  "answer_id": "11111111-1111-4111-8111-111111111111",
  "tenant_id": "11111111-1111-4111-8111-111111111111",
  "snapshot_manifest": "11111111-1111-4111-8111-111111111111",
  "valid_at": "2026-10-09T04:00:00Z",
  "known_at": "2026-10-09T04:00:00Z",
  "claims": [
    {
      "claim_id": "11111111-1111-4111-8111-111111111111",
      "text": "The parser recorded a call edge in the pinned fixture.",
      "kind": "observed",
      "evidence_ids": [
        "11111111-1111-4111-8111-111111111111"
      ],
      "confidence_method": "pinned AST evidence"
    }
  ],
  "unknowns": [
    "Dynamic calls were not resolved."
  ],
  "coverage": "partial",
  "expires_at": "2026-10-10T04:00:00Z"
}
